{"capture_id":"constructed-jsonl-v1-remove_fact-capture","capture_status":"valid","claim_scope":"constructed measurement-system test; no vendor qualification","decoded_sha256":"08e3dece218770ea7feca792594698e0ced11b1ff515296e46c021a574b3c3e5","decoder_version":"0.1.0","diagnostics":[],"evaluation_id":"eval-17e91bd3a210c15afc26b9e0ae4cff292c95a425a67c19e6acfb3ca8a4760aea","evaluator_version":"0.1.0","evidence_state":"valid","implementation_sha256":"76dc38d7d65f37ecb881665b389bca46517b28825ec1cf1b223c798c89f8c72f","manifest_sha256":"41e0ca39e274dab72e5d3880339f4784934405120b15046f8720590356ddee11","metrics":[{"assertion_ids":["event.m-1","event.m-2","event.m-correction","event.m-3","event.m-4"],"denominator":5,"numerator":5,"scope":"C01","state":"pass","unit":"assertions"},{"assertion_ids":["event.tc-1","event.tr-1","event.tc-2","event.tr-2","event.tc-3","event.tr-3","event.tc-4","event.tr-4","relationship.tool-envelope-helper"],"denominator":9,"numerator":8,"scope":"C02","state":"fail","unit":"assertions"},{"assertion_ids":["event.session-1","event.session-2","event.branch-main","event.branch-fork","event.attachment-1"],"denominator":5,"numerator":5,"scope":"C04","state":"pass","unit":"assertions"}],"origin":"derived_mutation","rows":[{"applicability":"required","boundary":"constructed","execution":"valid","fields":[{"actual":"session-1","actual_present":true,"comparison":"exact","expected":"session-1","name":"id","state":"pass"},{"actual":"session-1","actual_present":true,"comparison":"exact","expected":"session-1","name":"session_id","state":"pass"},{"actual":"session","actual_present":true,"comparison":"exact","expected":"session","name":"kind","state":"pass"},{"actual":"fixture-project","actual_present":true,"comparison":"text_lf","expected":"fixture-project","name":"fields.project","state":"pass"},{"actual":"constructed","actual_present":true,"comparison":"text_lf","expected":"constructed","name":"fields.surface","state":"pass"},{"actual":"unicode correction","actual_present":true,"comparison":"text_lf","expected":"unicode correction","name":"fields.title","state":"pass"}],"findings":[],"id":"event.session-1","inspection_evidence_ids":[],"locators":[{"artifact_id":"native-session","byte_end":153,"byte_start":0,"line":1,"record_sha256":"2265f38f529d02e1d092abad93474e03b3e5d2c1a5700a02eda768b134e1ac73","sha256":"cb5f57182b9245df62dcdb300d3e1b06f83be9fd940305172cbb8b215fec7f31"}],"observation_ids":["obs-001"],"outcome":"retained_and_reconstructed","scenario":"C04","state":"pass","subject":"decoder_correctness"},{"applicability":"required","boundary":"constructed","execution":"valid","fields":[{"actual":"session-2","actual_present":true,"comparison":"exact","expected":"session-2","name":"id","state":"pass"},{"actual":"session-2","actual_present":true,"comparison":"exact","expected":"session-2","name":"session_id","state":"pass"},{"actual":"session","actual_present":true,"comparison":"exact","expected":"session","name":"kind","state":"pass"},{"actual":"fixture-project","actual_present":true,"comparison":"text_lf","expected":"fixture-project","name":"fields.project","state":"pass"},{"actual":"constructed","actual_present":true,"comparison":"text_lf","expected":"constructed","name":"fields.surface","state":"pass"},{"actual":"second session","actual_present":true,"comparison":"text_lf","expected":"second session","name":"fields.title","state":"pass"}],"findings":[],"id":"event.session-2","inspection_evidence_ids":[],"locators":[{"artifact_id":"native-session","byte_end":302,"byte_start":153,"line":2,"record_sha256":"cf13402ea12816a6329bac3034c11ad21e860e435dd4978251266b7fdc9f653c","sha256":"cb5f57182b9245df62dcdb300d3e1b06f83be9fd940305172cbb8b215fec7f31"}],"observation_ids":["obs-002"],"outcome":"retained_and_reconstructed","scenario":"C04","state":"pass","subject":"decoder_correctness"},{"applicability":"required","boundary":"constructed","execution":"valid","fields":[{"actual":"branch-main","actual_present":true,"comparison":"exact","expected":"branch-main","name":"id","state":"pass"},{"actual":"session-1","actual_present":true,"comparison":"exact","expected":"session-1","name":"session_id","state":"pass"},{"actual":"branch","actual_present":true,"comparison":"exact","expected":"branch","name":"kind","state":"pass"},{"actual":"main","actual_present":true,"comparison":"text_lf","expected":"main","name":"fields.name","state":"pass"},{"actual":null,"actual_present":true,"comparison":"exact","expected":null,"name":"fields.parent_id","state":"pass"},{"actual":"active","actual_present":true,"comparison":"text_lf","expected":"active","name":"fields.status","state":"pass"}],"findings":[],"id":"event.branch-main","inspection_evidence_ids":[],"locators":[{"artifact_id":"native-session","byte_end":424,"byte_start":302,"line":3,"record_sha256":"e3c47465020d4e6a42d4ce9b732705d30b189a4b6a01beac903ed8ba40a504c8","sha256":"cb5f57182b9245df62dcdb300d3e1b06f83be9fd940305172cbb8b215fec7f31"}],"observation_ids":["obs-003"],"outcome":"retained_and_reconstructed","scenario":"C04","state":"pass","subject":"decoder_correctness"},{"applicability":"required","boundary":"constructed","execution":"valid","fields":[{"actual":"branch-fork","actual_present":true,"comparison":"exact","expected":"branch-fork","name":"id","state":"pass"},{"actual":"session-1","actual_present":true,"comparison":"exact","expected":"session-1","name":"session_id","state":"pass"},{"actual":"branch","actual_present":true,"comparison":"exact","expected":"branch","name":"kind","state":"pass"},{"actual":"repair","actual_present":true,"comparison":"text_lf","expected":"repair","name":"fields.name","state":"pass"},{"actual":"branch-main","actual_present":true,"comparison":"text_lf","expected":"branch-main","name":"fields.parent_id","state":"pass"},{"actual":"active","actual_present":true,"comparison":"text_lf","expected":"active","name":"fields.status","state":"pass"}],"findings":[],"id":"event.branch-fork","inspection_evidence_ids":[],"locators":[{"artifact_id":"native-session","byte_end":557,"byte_start":424,"line":4,"record_sha256":"d8d167d2adc32e7fe91da3630dce3d2310adb25e7c6da0917c53e7a796049ff4","sha256":"cb5f57182b9245df62dcdb300d3e1b06f83be9fd940305172cbb8b215fec7f31"}],"observation_ids":["obs-004"],"outcome":"retained_and_reconstructed","scenario":"C04","state":"pass","subject":"decoder_correctness"},{"applicability":"required","boundary":"constructed","execution":"valid","fields":[{"actual":"m-1","actual_present":true,"comparison":"exact","expected":"m-1","name":"id","state":"pass"},{"actual":"session-1","actual_present":true,"comparison":"exact","expected":"session-1","name":"session_id","state":"pass"},{"actual":"message","actual_present":true,"comparison":"exact","expected":"message","name":"kind","state":"pass"},{"actual":"user","actual_present":true,"comparison":"text_lf","expected":"user","name":"fields.role","state":"pass"},{"actual":"Inspect target.txt and fix the failing test. café 🙂","actual_present":true,"comparison":"text_lf","expected":"Inspect target.txt and fix the failing test. café 🙂","name":"fields.text","state":"pass"},{"actual":1,"actual_present":true,"comparison":"exact","expected":1,"name":"fields.turn","state":"pass"}],"findings":[],"id":"event.m-1","inspection_evidence_ids":[],"locators":[{"artifact_id":"native-session","byte_end":711,"byte_start":557,"line":5,"record_sha256":"4abd8ffbcde64c5c1c2cbbe7931959a751dcd7f216caf256f67dbf8cd97d070e","sha256":"cb5f57182b9245df62dcdb300d3e1b06f83be9fd940305172cbb8b215fec7f31"}],"observation_ids":["obs-005"],"outcome":"retained_and_reconstructed","scenario":"C01","state":"pass","subject":"decoder_correctness"},{"applicability":"required","boundary":"constructed","execution":"valid","fields":[{"actual":"m-2","actual_present":true,"comparison":"exact","expected":"m-2","name":"id","state":"pass"},{"actual":"session-1","actual_present":true,"comparison":"exact","expected":"session-1","name":"session_id","state":"pass"},{"actual":"message","actual_present":true,"comparison":"exact","expected":"message","name":"kind","state":"pass"},{"actual":"assistant","actual_present":true,"comparison":"text_lf","expected":"assistant","name":"fields.role","state":"pass"},{"actual":"I found the defect.\n```python\nreturn value  \n```","actual_present":true,"comparison":"text_lf","expected":"I found the defect.\n```python\nreturn value  \n```","name":"fields.text","state":"pass"},{"actual":1,"actual_present":true,"comparison":"exact","expected":1,"name":"fields.turn","state":"pass"}],"findings":[],"id":"event.m-2","inspection_evidence_ids":[],"locators":[{"artifact_id":"native-session","byte_end":866,"byte_start":711,"line":6,"record_sha256":"01f876856b1706b474e67fcd45766eac94dc2db59eae23a0a5bd6002c167dbd7","sha256":"cb5f57182b9245df62dcdb300d3e1b06f83be9fd940305172cbb8b215fec7f31"}],"observation_ids":["obs-006"],"outcome":"retained_and_reconstructed","scenario":"C01","state":"pass","subject":"decoder_correctness"},{"applicability":"required","boundary":"constructed","execution":"valid","fields":[{"actual":"tc-1","actual_present":true,"comparison":"exact","expected":"tc-1","name":"id","state":"pass"},{"actual":"session-1","actual_present":true,"comparison":"exact","expected":"session-1","name":"session_id","state":"pass"},{"actual":"tool_call","actual_present":true,"comparison":"exact","expected":"tool_call","name":"kind","state":"pass"},{"actual":"inspect","actual_present":true,"comparison":"text_lf","expected":"inspect","name":"fields.action_kind","state":"pass"},{"actual":{"command":"inspect fixture_project/target.py"},"actual_present":true,"comparison":"json","expected":{"command":"inspect fixture_project/target.py"},"name":"fields.arguments","state":"pass"},{"actual":1,"actual_present":true,"comparison":"exact","expected":1,"name":"fields.attempt","state":"pass"},{"actual":["h-1","h-2"],"actual_present":true,"comparison":"json","expected":["h-1","h-2"],"name":"fields.helper_ids","state":"pass"},{"actual":"shell","a